document_id,evidence_hash,dimension,score,quote_text,reasoning
steve_king_2017_house_floor.txt,3114790f30df7a37,manipulation,0.7,They are using categories or groups of people declaring it to be prosecutorial discretion when in fact it is not prosecutorial discretion because it applies to groups of people created for four different groups of people.,"Confidence: 0.7, Context: accusation_of_prosecutorial_discretion_misuse"
steve_king_2017_house_floor.txt,3114790f30df7a37,dignity,0.7,And that's what the 14th Amendment guarantees equal rights. And now this court has twisted it into a command that there's not a difference between a man and a woman when it comes to joining them together in matrimony.,"Confidence: 0.7, Context: redefinition_of_legal_concepts"
steve_king_2017_house_floor.txt,3114790f30df7a37,justice,0.7,"And it's constitutional and it fits the structure of our our United States Constitution along with the various state constitutions and the structure of the rule of law. But if a court wants to manufacture a new right, let alone a new command, that's wrong.","Confidence: 0.7, Context: critique_of_judicial_activism"
steve_king_2017_house_floor.txt,3114790f30df7a37,truth,0.7,"But it's no longer possible to look at this Supreme Court and discern what a likely decision of the Court might be by studying the text of the Constitution and the text of the law because we have a court that will write, make it up as they go along, write laws.","Confidence: 0.7, Context: accusation_of_unprincipled_judicial_decisions"
steve_king_2017_house_floor.txt,3114790f30df7a37,fear,0.6,"And I can stand here, Mr. Speaker, every night I could come here and give you these stats and I can give you the data on the thousands of Americans that are dead at the hands of the criminal aliens that have been incarcerated for a temporary period of time and released by multiple jurisdictions across this country.","Confidence: 0.6, Context: statement_of_consequences"
steve_king_2017_house_floor.txt,3114790f30df7a37,resentment,0.5,"My time DC time, and that was decision of Obergefell where the Supreme Court created a new command in the Constitution. Not just discover a right that never existed. They manufactured a command.","Confidence: 0.5, Context: assertion_of_judicial_overreach"
steve_king_2017_house_floor.txt,3114790f30df7a37,pragmatism,0.6,"Secure our borders. Restore their respect for the rule of law. Save these lives. Send these people into prison. And when they're done, send them back to the country that they can live in legally for the rest of their lives if they don't stay in our prisons for the rest of their lives.","Confidence: 0.6, Context: policy_recommendation"
